mysql> update Account SET email = 'joeysabbagh@email.com';                                                                          
Query OK, 1 row affected (0.00 sec)
Rows matched: 1  Changed: 1  Warnings: 0

mysql> SELECT * FROM Account;
+----+-----------------------+-------------+---------------------+---------------------+
| id | email                 | password    | createdOn           | modifiedOn          |
+----+-----------------------+-------------+---------------------+---------------------+
|  1 | joeysabbagh@email.com | supersecret | 2016-02-03 18:30:30 | 2016-03-03 19:30:00 |
+----+-----------------------+-------------+---------------------+---------------------+
1 row in set (0.00 sec)



mysql> update AddressBook SET name = 'joey';                                                                       
Query OK, 1 row affected (0.01 sec)
Rows matched: 1  Changed: 1  Warnings: 0

mysql> SELECT * FROM AddressBook;
+----+-----------+------+---------------------+---------------------+
| id | accountId | name | createdOn           | modifiedOn          |
+----+-----------+------+---------------------+---------------------+
|  1 |         1 | joey | 2016-02-03 18:30:30 | 2016-03-03 19:30:00 |
+----+-----------+------+---------------------+---------------------+
1 row in set (0.00 sec)



mysql> update Entry SET lastName = 'Smith';                                                                                                                          
Query OK, 2 rows affected (0.00 sec)
Rows matched: 4  Changed: 2  Warnings: 0


mysql> SELECT * FROM Entry;
+----+---------------+-----------+----------+---------------------+------+---------+-----------------+-----------------+------------------+-----------------+-----------------+
| id | addressBookId | firstName | lastName | birthday            | type | subtype | contentLineOne  | contentLineTwo  | contentLineThree | contentLineFour | contentLineFive |
+----+---------------+-----------+----------+---------------------+------+---------+-----------------+-----------------+------------------+-----------------+-----------------+
|  1 |             1 | Joseph    | Smith    | 1987-03-03 00:00:00 | home |         | this is a test1 | this is a test2 | this is a test3  | this is a test4 | this is a test5 |
|  2 |             1 | Mark      | Smith    | 1980-01-02 00:00:00 | home |         | this is a test1 | this is a test2 | this is a test3  | this is a test4 | this is a test5 |
|  3 |             1 | Mark      | Smith    | 1980-01-02 00:00:00 | home |         | this is a test1 | this is a test2 | this is a test3  | this is a test4 | this is a test5 |
|  4 |             1 | Steven    | Smith    | 1970-01-02 00:00:00 | home |         | this is a test1 | this is a test2 | this is a test3  | this is a test4 | this is a test5 |
+----+---------------+-----------+----------+---------------------+------+---------+-----------------+-----------------+------------------+-----------------+-----------------+
4 rows in set (0.00 sec)